,Nome,Descrição
0,Maestria do  Cultivo,"Você pode agora achar um  Biscoito de Animal Dourado  , que dobra permanentemente a eficiência daquele animal. Não funciona com Porcos."
1,Maestria da  Mineração,Nós de Minérios  agora dão o dobro de minerais.
2,Maestria de  Coleta,"Você agora pode achar  Caixas Douradas Misteriosas  , que contém itens superiores."
3,Maestria da  Pesca,Você agora pode encontrar  Baús do Tesouro Dourados  .
4,Maestria do Combate,Desbloqueia um novo espaço para  Amuletos  . Amuletos podem ser encontrados nas suas aventuras e garantir poderes especiais.
