,Imagem,Nome,Descrição,Encontrado em,Lucro,Usado em,origem
0,,Concha de náutilo,Uma concha antiga.,A Praia  (  Inverno  ),120 ouros  150 ouros  180 ouros  240 ouros,Conjunto Pesquisa de campo,praia
5,,Coral,Uma colônia de pequenas criaturas que se aglomeram para formarem lindas estruturas.,A Praia,80 ouros  100 ouros  120 ouros  160 ouros,Solo Foliar Premium  Totem de teletransporte: Praia,praia
10,,Ouriço-do-mar,Uma criatura lenta e espinhosa que alguns consideram uma iguaria.,A Praia,160 ouros  200 ouros  240 ouros  320 ouros,Conjunto Tinta,praia
15,,Concha arco-íris,É uma concha muito bonita.,A Praia  (  Verão  ),300 ouros  375 ouros  450 ouros  600 ouros,"Missão ""O Misterioso Qi""",praia
20,,Concha,Alguém já viveu aqui.,A Praia,50 ouros  62 ouros  75 ouros  100 ouros,Solo Foliar  Sopa de peixe  Conjunto Covo,praia
25,,Berbigão,Uma concha de água salgada muito comum.,A Praia,50 ouros  62 ouros  75 ouros  100 ouros,Conjunto Covo,praia
30,,Mexilhão,Um bivalve muito comum que geralmente vive em grupo.,A Praia,30 ouros  37 ouros  45 ouros  60 ouros,Guisado de peixe  Conjunto Covo,praia
35,,Ostra,"Filtra água constantemente para se alimentar. Durante o processo, remove toxinas perigosas para o meio ambiente.",A Praia,40 ouros  50 ouros  60 ouros  80 ouros,Conjunto Covo,praia
40,,Algas marinhas,Podem ser utilizadas na cozinha.,A Praia,20 ouros  25 ouros  30 ouros  40 ouros,Rolinhos de arroz  Lago de Peixes,praia
