,Conjunto Recursos de Inverno,Conjunto Recursos de Inverno.1,Conjunto Recursos de Inverno.2,Conjunto Recursos de Inverno.3
0,,,Raiz de inverno,"Arando  o solo ou  Pontos de artefatos  durante o  Inverno  , deixado por  Gosmas  Azuis nos andares 41-79 da  mina  ."
1,,,Fruta de cristal,"Colete  durante o  Inverno  , deixado por  Espíritos da Poeira  nos andares 41-79 da  mina  ."
2,,,Inhame de neve,Arando  o solo ou  Pontos de Artefatos  durante o  Inverno  .
3,,,Flor de açafrão,Colete  durante o  Inverno  .
4,Recompensa:,Recompensa:,Sementes de inverno  (30),Sementes de inverno  (30)
