,Conjunto de Aventureiro,Conjunto de Aventureiro.1,Conjunto de Aventureiro.2,Conjunto de Aventureiro.3
0,,,Gosma  (99),Deixada por  Gosmas  .
1,,,Asa de morcego  (10),Deixadas por  Morcegos  nas  Minas  .
2,,,Essência solar,"Deixada por  Fantasmas  ,  Faces  ou  Cabeças de metal  nas  Minas  , deixada por  Múmias  na  Caverna da Caveira  ."
3,,,Essência nula,Deixada por  Brutos das sombras  nas  Minas  ou  Serpentes  na  Caverna da Caveira  .
4,Recompensa:,Recompensa:,Pequeno anel com ímã  (1),Pequeno anel com ímã  (1)
